,Pustular Mat  1,Pustular Mat  2,Pustular Mat  3,Pustular Mat  4,Pustular Mat  5,Smooth Mat 1,Smooth Mat 2,Smooth Mat 3,Smooth Mat 4,Smooth Mat 5
K02035: ABC.PE.S; peptide/nickel transport system substrate-binding protein,224,36,27,95,126,162,342,303,135,193
K02406: fliC; flagellin,50,6,4,48,40,218,146,245,154,165
K02040: pstS; phosphate transport system substrate-binding protein,146,24,2,72,84,144,156,83,119,132
"K04077: groEL, HSPD1; chaperonin GroEL",160,27,7,179,46,110,90,112,69,14
K03696: clpC; ATP-dependent Clp protease ATP-binding subunit ClpC,148,31,12,63,68,117,104,113,43,45
K02014: TC.FEV.OM; iron complex outermembrane recepter protein,106,17,29,58,62,138,68,102,87,36
K03406: mcp; methyl-accepting chemotaxis protein,26,3,36,28,14,144,76,137,142,56
"K04043: dnaK, HSPA9; molecular chaperone DnaK",106,17,10,104,35,107,78,96,41,29
K02027: ABC.MS.S; multiple sugar transport system substrate-binding protein,64,13,3,39,51,74,124,73,79,94
K03086: rpoD; RNA polymerase primary sigma factor,106,14,5,39,44,109,62,102,54,33
K08929: pufM; photosynthetic reaction center M subunit,82,28,2,86,55,69,46,39,51,51
"K01077: phoA, phoB; alkaline phosphatase [EC:3.1.3.1]",68,6,1,40,21,86,38,46,82,92
"K03737: por, nifJ; pyruvate-ferredoxin/flavodoxin oxidoreductase [EC:1.2.7.1 1.2.7.-]",46,6,3,55,59,56,62,85,47,43
K08928: pufL; photosynthetic reaction center L subunit,58,20,2,79,53,42,30,32,50,55
"K03088: rpoE; RNA polymerase sigma-70 factor, ECF subfamily",94,15,6,41,47,80,42,43,26,25
"K02355: fusA, GFM, EFG; elongation factor G",56,11,10,51,51,47,42,74,40,36
"K02358: tuf, TUFM; elongation factor Tu",76,11,7,31,38,64,68,53,42,27
"K03527: ispH, lytB; 4-hydroxy-3-methylbut-2-en-1-yl diphosphate reductase [EC:1.17.7.4]",68,10,5,33,35,67,52,75,42,23
K03046: rpoC; DNA-directed RNA polymerase subunit beta' [EC:2.7.7.6],88,7,10,39,27,62,56,79,7,21
K03087: rpoS; RNA polymerase nonessential primary-like sigma factor,58,6,5,30,33,76,46,73,47,20
K02689: psaA; photosystem I P700 chlorophyll a apoprotein A1,86,23,5,63,43,48,58,21,31,15
K02703: psbA; photosystem II P680 reaction center D1 protein [EC:1.10.3.9],68,23,1,67,37,55,40,32,43,27
K00986: ltrA; RNA-directed DNA polymerase [EC:2.7.7.49],50,8,1,24,20,109,34,57,50,36
"K02945: RP-S1, rpsA; small subunit ribosomal protein S1",54,9,4,30,29,60,52,73,41,22
K07093: phoX; Alkaline phosphatase,78,16,5,43,50,37,38,38,33,34
K02690: psaB; photosystem I P700 chlorophyll a apoprotein A2,66,20,2,56,38,45,66,38,27,12
"K15580: oppA, mppA; oligopeptide transport system substrate-binding protein",22,1,4,12,26,47,80,59,41,49
"K01006: ppdK; pyruvate, orthophosphate dikinase [EC:2.7.9.1]",6,1,1,36,29,63,54,67,39,44
"K12132: prkC, stkP; eukaryotic-like serine/threonine-protein kinase [EC:2.7.11.1]",56,4,12,40,43,18,62,63,13,27
K01999: livK; branched-chain amino acid transport system substrate-binding protein,40,5,20,37,26,35,76,26,39,33
"K00134: GAPDH, gapA; glyceraldehyde 3-phosphate dehydrogenase [EC:1.2.1.12]",52,7,3,37,34,38,58,42,34,21
K03043: rpoB; DNA-directed RNA polymerase subunit beta [EC:2.7.7.6],60,3,8,35,32,45,50,65,16,12
K13797: rpoBC; DNA-directed RNA polymerase subunit beta-beta' [EC:2.7.7.6],78,6,12,27,18,62,32,64,12,14
"K04078: groES, HSPE1; chaperonin GroES",66,6,1,79,18,36,30,38,24,11
K13993: HSP20; HSP20 family protein,66,8,1,56,22,57,32,23,26,12
K03388: hdrA2; heterodisulfide reductase subunit A2 [EC:1.8.7.3 1.8.98.4 1.8.98.5 1.8.98.6],0,1,0,9,12,36,70,123,19,19
"K01897: ACSL, fadD; long-chain acyl-CoA synthetase [EC:6.2.1.3]",26,3,18,20,17,41,48,65,19,30
K01802: peptidylprolyl isomerase [EC:5.2.1.8],52,6,16,25,26,38,30,45,19,20
"K03798: ftsH, hflB; cell division protease FtsH [EC:3.4.24.-]",56,4,6,27,20,46,36,51,13,18
K02002: proX; glycine betaine/proline transport system substrate-binding protein,22,7,2,16,15,60,54,45,22,32
"K01895: ACSS1_2, acs; acetyl-CoA synthetase [EC:6.2.1.1]",8,3,11,22,27,33,50,35,35,48
"K01007: pps, ppsA; pyruvate, water dikinase [EC:2.7.9.2]",12,3,5,30,29,35,36,56,35,27
K10439: rbsB; ribose transport system substrate-binding protein,6,4,4,17,9,43,58,47,32,46
"K08884: serine/threonine protein kinase, bacterial [EC:2.7.11.1]",56,3,8,29,28,19,36,48,12,21
K07496: putative transposase,20,2,2,12,8,49,40,42,49,32
K01990: ABC-2.A; ABC-2 type transport system ATP-binding protein,28,6,29,25,27,27,16,55,20,15
K01338: lon; ATP-dependent Lon protease [EC:3.4.21.53],48,3,9,20,24,38,46,33,12,14
"K02520: infC, MTIF3; translation initiation factor IF-3",46,10,3,14,19,52,18,44,18,18
K03671: trxA; thioredoxin 1,66,13,7,25,19,39,22,14,24,9
K07114: yfbK; Ca-activated chloride channel homolog,30,7,1,26,16,36,36,48,15,21
"K02111: ATPF1A, atpA; F-type H+/Na+-transporting ATPase subunit alpha [EC:7.1.2.2 7.2.2.1]",36,8,5,27,28,31,22,27,35,13
K02285: cpcB; phycocyanin beta chain,58,15,2,25,18,34,36,16,19,4
"K05377: cpeB, mpeB; phycoerythrin beta chain",58,15,2,25,18,34,36,16,19,4
K05692: ACTB_G1; actin beta/gamma 1,36,3,1,21,25,31,30,26,29,23
K02037: pstC; phosphate transport system permease protein,28,4,1,26,19,23,48,33,10,30
"K00615: E2.2.1.1, tktA, tktB; transketolase [EC:2.2.1.1]",44,8,3,29,14,37,18,24,25,19
"K00626: E2.3.1.9, atoB; acetyl-CoA C-acetyltransferase [EC:2.3.1.9]",22,0,8,14,13,18,46,58,12,24
"K01251: E3.3.1.1, ahcY; adenosylhomocysteinase [EC:3.3.1.1]",32,8,1,22,20,40,34,26,12,16
K03738: aor; aldehyde:ferredoxin oxidoreductase [EC:1.2.7.5],2,0,0,8,6,37,60,65,9,19
"K06147: ABCB-BAC; ATP-binding cassette, subfamily B, bacterial",30,5,32,19,25,24,22,33,10,5
"K00059: fabG, OAR1; 3-oxoacyl-[acyl-carrier protein] reductase [EC:1.1.1.100]",34,7,13,17,28,18,28,27,12,19
"K00962: pnp, PNPT1; polyribonucleotide nucleotidyltransferase [EC:2.7.7.8]",32,5,6,13,18,32,28,44,13,8
"K01915: glnA, GLUL; glutamine synthetase [EC:6.3.1.2]",34,4,7,29,15,32,24,15,24,15
K07004: K07004; uncharacterized protein,46,4,0,11,22,38,20,24,17,15
K07033: K07033; uncharacterized protein,72,17,4,12,12,20,26,24,3,6
"K02519: infB, MTIF2; translation initiation factor IF-2",34,4,3,14,18,37,26,39,6,14
"K03386: PRDX2_4, ahpC; peroxiredoxin (alkyl hydroperoxide reductase subunit C) [EC:1.11.1.15]",48,8,5,15,17,25,16,26,18,15
K02058: ABC.SS.S; simple sugar transport system substrate-binding protein,6,1,4,12,9,28,46,23,27,36
"K04079: HSP90A, htpG; molecular chaperone HtpG",22,2,18,32,15,45,16,13,19,8
"K03407: cheA; two-component system, chemotaxis family, sensor kinase CheA [EC:2.7.13.3]",18,0,13,9,7,32,20,42,34,13
K01601: rbcL; ribulose-bisphosphate carboxylase large chain [EC:4.1.1.39],34,7,1,29,32,18,8,19,23,15
K00335: nuoF; NADH-quinone oxidoreductase subunit F [EC:7.1.1.2],6,1,8,16,20,25,26,26,36,20
K02470: gyrB; DNA gyrase subunit B [EC:5.6.2.2],30,3,5,14,13,39,32,34,7,7
K02033: ABC.PE.P; peptide/nickel transport system permease protein,36,4,17,18,21,17,30,20,4,15
"K00688: PYG, glgP; glycogen phosphorylase [EC:2.4.1.1]",30,11,2,18,16,26,20,35,9,9
K07180: prkA; serine protein kinase,44,4,0,11,15,18,30,40,2,11
K02284: cpcA; phycocyanin alpha chain,32,12,0,25,19,35,18,15,12,4
"K05376: cpeA, mpeA; phycoerythrin alpha chain",32,12,0,25,19,35,18,15,12,4
K03695: clpB; ATP-dependent Clp protease ATP-binding subunit ClpB,34,5,3,26,13,23,26,25,8,8
"K02010: afuC, fbpC; iron(III) transport system ATP-binding protein [EC:7.2.2.7]",12,8,7,19,14,17,26,18,20,28
K00666: K00666; fatty-acyl-CoA synthase [EC:6.2.1.-],8,2,9,13,12,16,38,48,5,15
K02706: psbD; photosystem II P680 reaction center D2 protein [EC:1.10.3.9],28,9,0,22,17,30,18,12,19,10
"K00123: fdoG, fdhF, fdwA; formate dehydrogenase major subunit [EC:1.17.1.9]",22,5,6,16,22,17,24,16,18,18
K01768: E4.6.1.1; adenylate cyclase [EC:4.6.1.1],30,1,10,16,14,18,18,28,8,20
K02650: pilA; type IV pilus assembly protein PilA,26,5,0,19,15,18,16,12,27,25
K02003: ABC.CD.A; putative ABC transport system ATP-binding protein,18,1,14,8,12,22,26,42,8,11
K06894: yfhM; alpha-2-macroglobulin,6,2,4,9,4,27,28,62,6,14
K02030: ABC.PA.S; polar amino acid transport system substrate-binding protein,18,2,12,17,12,14,26,24,14,20
K02032: ABC.PE.A1; peptide/nickel transport system ATP-binding protein,32,3,5,10,7,15,32,37,3,14
K11389: gapor; glyceraldehyde-3-phosphate dehydrogenase (ferredoxin) [EC:1.2.7.6],0,0,0,7,6,27,46,51,7,14
"K10112: msmX, msmK, malK, sugC, ggtA, msiK; multiple sugar transport system ATP-binding protein",12,7,4,19,9,17,24,19,19,27
K08927: pufB; light-harvesting complex 1 beta chain,18,5,2,21,28,8,18,17,18,21
K18682: rny; ribonucrease Y [EC:3.1.-.-],4,2,2,8,4,23,40,47,12,13
K00169: porA; pyruvate ferredoxin oxidoreductase alpha subunit [EC:1.2.7.1],4,1,1,9,18,15,28,47,15,16
"K01624: FBA, fbaA; fructose-bisphosphate aldolase, class II [EC:4.1.2.13]",24,9,6,10,12,23,18,16,22,14
K02031: ABC.PE.A; peptide/nickel transport system ATP-binding protein,32,3,5,6,12,16,28,29,5,17
"K00394: aprA; adenylylsulfate reductase, subunit A [EC:1.8.99.2]",0,0,0,8,14,20,24,15,49,21
K02004: ABC.CD.P; putative ABC transport system permease protein,10,2,16,13,13,30,24,26,8,9
K18897: sdmt; sarcosine/dimethylglycine N-methyltransferase [EC:2.1.1.157],52,1,0,9,11,16,30,20,4,7
K02469: gyrA; DNA gyrase subunit A [EC:5.6.2.2],16,4,13,13,13,22,18,38,7,4
K15013: ACSBG; long-chain-fatty-acid--CoA ligase ACSBG [EC:6.2.1.3],2,0,7,0,1,104,0,34,0,0
"K00174: korA, oorA, oforA; 2-oxoglutarate/2-oxoacid ferredoxin oxidoreductase subunit alpha [EC:1.2.7.3 1.2.7.11]",12,5,1,17,8,28,20,33,12,11
"K00656: E2.3.1.54, pflD; formate C-acetyltransferase [EC:2.3.1.54]",10,3,1,15,0,41,24,15,27,11
K01992: ABC-2.P; ABC-2 type transport system permease protein,16,1,28,16,10,17,20,21,5,13
"K03797: E3.4.21.102, prc, ctpA; carboxyl-terminal processing protease [EC:3.4.21.102]",38,7,5,9,12,24,12,23,12,4
K09014: sufB; Fe-S cluster assembly protein SufB,60,12,3,10,9,15,14,17,2,4
"K00412: CYTB, petB; ubiquinol-cytochrome c reductase cytochrome b subunit",36,1,3,27,18,16,10,10,14,10
K03704: cspA; cold shock protein,24,4,4,11,14,11,38,26,7,6
"K02864: RP-L10, MRPL10, rplJ; large subunit ribosomal protein L10",28,3,5,18,9,18,14,23,15,10
K00128: ALDH; aldehyde dehydrogenase (NAD+) [EC:1.2.1.3],22,6,10,11,10,18,26,13,10,16
"K02483: K02483; two-component system, OmpR family, response regulator",32,4,18,23,16,16,12,12,5,4
"K04771: degP, htrA; serine protease Do [EC:3.4.21.107]",34,2,4,14,12,27,16,20,7,6
K02038: pstA; phosphate transport system permease protein,12,2,1,12,10,20,32,23,5,23
"K00248: ACADS, bcd; butyryl-CoA dehydrogenase [EC:1.3.8.1]",16,1,5,20,17,20,16,26,8,9
"K01358: clpP, CLPP; ATP-dependent Clp protease, protease subunit [EC:3.4.21.92]",42,3,2,11,17,12,18,14,8,11
"K01647: CS, gltA; citrate synthase [EC:2.3.3.1]",26,2,6,19,8,18,6,26,17,10
"K03544: clpX, CLPX; ATP-dependent Clp protease ATP-binding subunit ClpX",22,6,2,19,13,25,16,11,11,13
"K01069: gloB, gloC, HAGH; hydroxyacylglutathione hydrolase [EC:3.1.2.6]",10,6,5,20,15,32,14,12,13,10
K02705: psbC; photosystem II CP43 chlorophyll apoprotein,18,4,1,22,17,14,16,14,22,8
"K00548: metH, MTR; 5-methyltetrahydrofolate--homocysteine methyltransferase [EC:2.1.1.13]",16,2,0,11,9,16,30,23,8,20
K02025: ABC.MS.P; multiple sugar transport system permease protein,38,2,9,13,13,5,22,15,12,6
"K10355: ACTF; actin, other eukaryote",20,0,0,11,11,18,22,21,17,15
"K00184: K00184; prokaryotic molybdopterin-containing oxidoreductase family, iron-sulfur binding subunit",14,2,3,16,27,10,20,17,8,17
"K00384: trxB, TRR; thioredoxin reductase (NADPH) [EC:1.8.1.9]",28,2,3,9,12,20,22,10,20,7
"K00525: E1.17.4.1A, nrdA, nrdE; ribonucleoside-diphosphate reductase alpha chain [EC:1.17.4.1]",20,0,12,13,13,29,16,19,4,7
"K02112: ATPF1B, atpD; F-type H+/Na+-transporting ATPase subunit beta [EC:7.1.2.2 7.2.2.1]",20,5,1,25,12,13,6,22,15,14
"K00239: sdhA, frdA; succinate dehydrogenase / fumarate reductase, flavoprotein subunit [EC:1.3.5.1 1.3.5.4]",16,2,5,11,13,12,26,16,20,11
K02026: ABC.MS.P1; multiple sugar transport system permease protein,38,4,11,12,13,9,10,13,8,14
"K02967: RP-S2, MRPS2, rpsB; small subunit ribosomal protein S2",12,1,2,12,7,29,18,31,9,11
K03070: secA; preprotein translocase subunit SecA [EC:7.4.2.8],20,1,5,14,13,21,14,32,7,5
K18896: gsmt; glycine/sarcosine N-methyltransferase [EC:2.1.1.156],46,2,0,7,11,14,24,16,5,6
K02600: nusA; transcription termination/antitermination protein NusA,22,2,3,12,9,22,28,21,2,9
"K00249: ACADM, acd; acyl-CoA dehydrogenase [EC:1.3.8.7]",20,0,10,17,15,14,16,24,4,9
"K00616: E2.2.1.2, talA, talB; transaldolase [EC:2.2.1.2]",30,7,0,12,11,24,12,15,10,8
K11959: urtA; urea transport system substrate-binding protein,12,1,6,15,13,13,24,8,20,17
K19226: sapA; cationic peptide transport system substrate-binding protein,8,0,0,4,9,17,42,24,10,15
K02316: dnaG; DNA primase [EC:2.7.7.101],16,0,3,7,16,18,24,24,8,11
"K02950: RP-S12, MRPS12, rpsL; small subunit ribosomal protein S12",18,1,1,12,12,23,16,18,21,5
"K02982: RP-S3, rpsC; small subunit ribosomal protein S3",8,1,4,10,14,27,14,31,6,12
K13992: pufC; photosynthetic reaction center cytochrome c subunit,10,1,0,14,18,6,16,21,13,28
K01138: K01138; uncharacterized sulfatase [EC:3.1.6.-],20,2,3,14,22,20,16,17,3,9
K01537: ATP2C; P-type Ca2+ transporter type 2C [EC:7.2.2.10],14,2,2,14,9,16,16,46,4,3
K14645: K14645; serine protease [EC:3.4.21.-],16,2,0,12,8,16,14,28,8,22
K00436: hoxH; NAD-reducing hydrogenase large subunit [EC:1.12.1.2],8,1,0,11,17,12,16,24,19,17
"K01176: AMY, amyA, malS; alpha-amylase [EC:3.2.1.1]",8,0,7,9,11,27,16,24,8,15
K03530: hupB; DNA-binding protein HU-beta,16,6,6,15,6,25,12,7,18,13
K03924: moxR; MoxR-like ATPase [EC:3.6.3.-],26,0,8,15,13,7,16,26,6,7
K02635: petB; cytochrome b6,30,1,2,26,16,12,10,8,12,6
"K00058: serA, PHGDH; D-3-phosphoglycerate dehydrogenase / 2-oxoglutarate reductase [EC:1.1.1.95 1.1.1.399]",20,1,10,7,12,9,18,25,11,9
"K00382: DLD, lpd, pdhD; dihydrolipoamide dehydrogenase [EC:1.8.1.4]",26,6,5,13,13,14,18,10,8,9
K01533: copB; P-type Cu2+ transporter [EC:7.2.2.9],32,2,11,9,10,22,10,16,6,3
"K01652: E2.2.1.6L, ilvB, ilvG, ilvI; acetolactate synthase I/II/III large subunit [EC:2.2.1.6]",22,2,9,9,7,16,14,24,5,13
K02588: nifH; nitrogenase iron protein NifH,4,2,0,10,20,31,20,6,2,26
K03628: rho; transcription termination factor Rho,20,2,2,13,14,27,16,19,2,6
"K04564: SOD2; superoxide dismutase, Fe-Mn family [EC:1.15.1.1]",28,4,1,14,11,15,22,15,3,8
K10352: MYH; myosin heavy chain,8,1,3,14,11,28,30,9,6,11
K07263: pqqL; zinc protease [EC:3.4.24.-],28,3,1,11,13,18,16,13,10,7
K02092: apcA; allophycocyanin alpha subunit,24,8,0,17,11,14,18,10,12,5
"K17686: copA, ctpA, ATP7; P-type Cu+ transporter [EC:7.2.2.8]",38,3,13,6,6,21,10,16,4,2
"K01610: E4.1.1.49, pckA; phosphoenolpyruvate carboxykinase (ATP) [EC:4.1.1.49]",14,1,2,16,20,18,12,10,13,12
"K00627: DLAT, aceF, pdhC; pyruvate dehydrogenase E2 component (dihydrolipoamide acetyltransferase) [EC:2.3.1.12]",10,0,3,10,14,25,16,20,8,10
K03040: rpoA; DNA-directed RNA polymerase subunit alpha [EC:2.7.7.6],12,1,2,16,5,22,20,26,5,7
"K07335: bmpA, bmpB, tmpC; basic membrane protein A and related proteins",8,0,6,10,8,9,34,14,10,17
"K01784: galE, GALE; UDP-glucose 4-epimerase [EC:5.1.3.2]",12,2,3,13,18,5,18,24,6,14
K01996: livF; branched-chain amino acid transport system ATP-binding protein,10,1,9,2,6,26,14,22,9,16
K12368: dppA; dipeptide transport system substrate-binding protein,8,0,0,4,8,15,34,19,12,15
K15255: PIF1; ATP-dependent DNA helicase PIF1 [EC:3.6.4.12],0,0,5,1,6,59,8,35,1,0
"K01621: xfp, xpk; xylulose-5-phosphate/fructose-6-phosphate phosphoketolase [EC:4.1.2.9 4.1.2.22]",38,5,2,14,10,8,8,16,12,1
K05845: opuC; osmoprotectant transport system substrate-binding protein,14,4,2,14,7,13,22,15,8,15
K02256: COX1; cytochrome c oxidase subunit 1 [EC:1.9.3.1],14,1,2,9,8,36,8,14,15,6
"K02871: RP-L13, MRPL13, rplM; large subunit ribosomal protein L13",12,0,0,20,14,18,12,11,11,15
"K04487: iscS, NFS1; cysteine desulfurase [EC:2.8.1.7]",20,1,7,11,10,18,14,22,4,6
"K00262: E1.4.1.4, gdhA; glutamate dehydrogenase (NADP+) [EC:1.4.1.4]",8,0,1,11,8,16,14,20,23,10
K01187: malZ; alpha-glucosidase [EC:3.2.1.20],12,1,3,9,13,9,24,22,5,13
K02096: apcE; phycobilisome core-membrane linker protein,20,5,0,12,11,16,18,7,17,5
K02505: hofC; protein transport protein HofC,26,4,4,15,11,8,12,17,6,8
K02586: nifD; nitrogenase molybdenum-iron protein alpha chain [EC:1.18.6.1],2,3,0,10,32,13,18,4,0,28
"K03296: TC.HAE1; hydrophobic/amphiphilic exporter-1 (mainly G- bacteria), HAE1 family",30,1,28,6,9,10,6,7,7,6
K05813: ugpB; sn-glycerol 3-phosphate transport system substrate-binding protein,34,2,2,8,11,6,18,9,14,6
K10236: thuE; trehalose/maltose transport system substrate-binding protein,10,0,0,8,5,11,22,16,14,24
K13810: tal-pgi; transaldolase / glucose-6-phosphate isomerase [EC:2.2.1.2 5.3.1.9],22,7,4,12,8,20,10,12,11,4
K00266: gltD; glutamate synthase (NADPH) small chain [EC:1.4.1.13],4,1,2,7,6,27,16,22,13,11
"K00850: pfkA, PFK; 6-phosphofructokinase 1 [EC:2.7.1.11]",10,1,6,6,9,17,14,25,11,10
"K01130: E3.1.6.1, aslA; arylsulfatase [EC:3.1.6.1]",22,1,3,12,26,19,6,13,5,2
"K01710: E4.2.1.46, rfbB, rffG; dTDP-glucose 4,6-dehydratase [EC:4.2.1.46]",30,2,4,8,12,9,12,22,4,6
"K01803: TPI, tpiA; triosephosphate isomerase (TIM) [EC:5.3.1.1]",16,2,1,7,16,15,12,18,12,10
K02034: ABC.PE.P1; peptide/nickel transport system permease protein,22,1,7,9,7,5,28,20,4,6
K01081: E3.1.3.5; 5'-nucleotidase [EC:3.1.3.5],16,4,4,13,7,19,16,14,7,8
"K01126: E3.1.4.46, glpQ, ugpQ; glycerophosphoryl diester phosphodiesterase [EC:3.1.4.46]",20,6,5,12,7,8,6,15,17,12
"K01681: ACO, acnA; aconitate hydratase [EC:4.2.1.3]",20,2,18,10,14,16,12,2,8,6
"K01689: ENO, eno; enolase [EC:4.2.1.11]",10,1,3,10,6,24,12,20,9,13
"K02274: coxA, ctaD; cytochrome c oxidase subunit I [EC:1.9.3.1]",28,4,1,11,23,10,6,13,5,7
"K02863: RP-L1, MRPL1, rplA; large subunit ribosomal protein L1",12,0,2,5,6,23,12,29,10,9
K04047: dps; starvation-inducible DNA-binding protein,38,5,0,8,10,13,12,11,3,8
K03553: recA; recombination protein RecA,20,3,2,11,9,9,22,19,7,5
K15987: hppA; K(+)-stimulated pyrophosphate-energized sodium pump,4,2,1,10,4,7,22,19,15,23
K02652: pilB; type IV pilus assembly protein PilB,22,4,4,15,11,10,12,14,6,7
K03782: katG; catalase-peroxidase [EC:1.11.1.21],30,2,4,11,4,8,20,14,5,7
K02438: glgX; glycogen debranching enzyme [EC:3.2.1.196],16,0,0,2,11,19,12,18,13,13
"K02952: RP-S13, rpsM; small subunit ribosomal protein S13",14,2,1,6,14,11,18,24,8,6
K03969: pspA; phage shock protein A,16,2,0,13,3,23,6,22,10,9
"K09458: fabF, OXSM, CEM1; 3-oxoacyl-[acyl-carrier-protein] synthase II [EC:2.3.1.179]",24,2,4,8,14,9,14,13,10,6
K03832: tonB; periplasmic protein TonB,18,6,1,4,9,19,12,12,14,8
K02036: pstB; phosphate transport system ATP-binding protein [EC:7.3.2.1],20,4,0,12,13,12,6,16,12,7
"K00284: GLU, gltS; glutamate synthase (ferredoxin) [EC:1.4.7.1]",30,4,6,10,12,9,6,6,9,9
"K00632: fadA, fadI; acetyl-CoA acyltransferase [EC:2.3.1.16]",16,1,5,5,6,13,16,19,6,14
K00789: metK; S-adenosylmethionine synthetase [EC:2.5.1.6],8,2,2,11,12,17,14,16,9,10
K02243: comGA; competence protein ComGA,20,4,4,14,11,8,12,15,6,7
K03168: topA; DNA topoisomerase I [EC:5.6.2.1],26,1,1,10,14,7,10,25,5,2
K03231: EEF1A; elongation factor 1-alpha,8,0,0,8,10,24,14,21,10,6
K00226: pyrD; dihydroorotate dehydrogenase (fumarate) [EC:1.3.98.1],2,1,2,9,19,19,6,24,9,9
K02044: phnD; phosphonate transport system substrate-binding protein,10,1,0,10,14,14,16,10,10,15
"K02906: RP-L3, MRPL3, rplC; large subunit ribosomal protein L3",6,0,2,5,11,24,10,26,11,5
"K01596: E4.1.1.32, pckA, PCK; phosphoenolpyruvate carboxykinase (GTP) [EC:4.1.1.32]",0,2,4,11,13,15,20,16,6,12
"K01966: PCCB, pccB; propionyl-CoA carboxylase beta chain [EC:6.4.1.3 2.1.3.15]",8,1,3,4,10,7,30,12,12,12
K02056: ABC.SS.A; simple sugar transport system ATP-binding protein [EC:7.5.2.-],6,2,7,2,9,17,20,13,10,13
"K02886: RP-L2, MRPL2, rplB; large subunit ribosomal protein L2",12,0,3,5,14,10,12,30,9,4
K04088: hflK; modulator of FtsH protease HflK,12,2,3,7,3,29,16,19,4,4
"K02275: coxB, ctaC; cytochrome c oxidase subunit II [EC:1.9.3.1]",14,6,5,18,6,16,10,7,8,8
K03561: exbB; biopolymer transport protein ExbB,12,3,5,19,14,17,4,6,11,7
"K00927: PGK, pgk; phosphoglycerate kinase [EC:2.7.2.3]",14,2,0,5,12,20,10,16,12,6
"K02108: ATPF0A, atpB; F-type H+-transporting ATPase subunit a",16,4,3,11,11,10,14,10,11,7
"K03106: SRP54, ffh; signal recognition particle subunit SRP54 [EC:3.6.5.4]",16,1,3,3,3,22,14,25,4,6
K01995: livG; branched-chain amino acid transport system ATP-binding protein,4,1,10,1,5,20,16,16,9,14
"K04035: E1.14.13.81, acsF, chlE; magnesium-protoporphyrin IX monomethyl ester (oxidative) cyclase [EC:1.14.13.81]",10,5,1,13,11,13,14,11,12,6
"K15584: nikA, cntA; nickel transport system substrate-binding protein",6,2,0,2,4,15,22,13,13,19
"K03403: chlH, bchH; magnesium chelatase subunit H [EC:6.6.1.1]",10,2,3,11,11,8,22,6,16,6
K00265: gltB; glutamate synthase (NADPH) large chain [EC:1.4.1.13],28,4,5,6,11,9,6,7,9,9
K01113: phoD; alkaline phosphatase D [EC:3.1.3.1],22,3,2,8,6,11,14,7,7,14
"K02988: RP-S5, MRPS5, rpsE; small subunit ribosomal protein S5",10,2,1,7,9,17,8,24,8,8
"K06148: ABCC-BAC; ATP-binding cassette, subfamily C, bacterial",16,1,25,7,14,10,8,9,3,1
K09181: yfiQ; acetyltransferase,6,1,1,10,4,11,18,23,11,9
K00367: narB; ferredoxin-nitrate reductase [EC:1.7.7.2],20,3,0,14,17,5,10,9,7,8
K10117: msmE; raffinose/stachyose/melibiose transport system substrate-binding protein,4,4,2,4,2,7,24,9,26,11
K00336: nuoG; NADH-quinone oxidoreductase subunit G [EC:7.1.1.2],4,1,0,11,10,20,10,6,16,14
K00937: ppk; polyphosphate kinase [EC:2.7.4.1],14,2,19,8,8,11,6,13,3,8
"K02109: ATPF0B, atpF; F-type H+-transporting ATPase subunit b",10,5,3,10,11,5,6,16,13,13
"K02867: RP-L11, MRPL11, rplK; large subunit ribosomal protein L11",20,1,2,7,4,13,14,18,6,7
K07315: rsbU_P; phosphoserine phosphatase RsbU/P [EC:3.1.3.3],6,2,3,12,8,15,10,21,2,13
"K02878: RP-L16, MRPL16, rplP; large subunit ribosomal protein L16",14,1,1,5,9,16,12,19,8,6
"K00700: GBE1, glgB; 1,4-alpha-glucan branching enzyme [EC:2.4.1.18]",16,1,0,12,7,16,12,21,0,5
K02669: pilT; twitching motility protein PilT,20,4,7,14,6,9,10,7,5,8
K04072: adhE; acetaldehyde dehydrogenase / alcohol dehydrogenase [EC:1.2.1.10 1.1.1.1],10,1,0,13,8,14,8,17,16,3
K07080: K07080; uncharacterized protein,10,2,0,4,5,9,16,7,20,17
K02005: ABC.CD.TX; HlyD family secretion protein,16,2,4,5,7,20,8,17,4,6
K02660: pilJ; twitching motility protein PilJ,8,3,8,7,3,10,8,3,30,9
K04034: bchE; anaerobic magnesium-protoporphyrin IX monomethyl ester cyclase [EC:1.21.98.3],2,4,1,7,2,14,26,15,9,9
"K07657: phoB; two-component system, OmpR family, phosphate regulon response regulator PhoB",20,1,5,12,8,12,12,12,3,4
K03408: cheW; purine-binding chemotaxis protein CheW,4,1,2,3,3,20,12,12,22,9
K03776: aer; aerotaxis receptor,8,0,22,2,4,16,6,12,14,4
"K03821: phbC, phaC; polyhydroxyalkanoate synthase subunit PhaC [EC:2.3.1.-]",14,1,1,17,16,6,18,5,3,7
"K13525: VCP, CDC48; transitional endoplasmic reticulum ATPase",20,0,1,1,1,16,12,35,1,1
K02591: nifK; nitrogenase molybdenum-iron protein beta chain [EC:1.18.6.1],4,1,0,13,26,11,8,4,0,20
"K02933: RP-L6, MRPL6, rplF; large subunit ribosomal protein L6",18,4,2,6,6,11,4,23,7,6
"K11645: fbaB; fructose-bisphosphate aldolase, class I [EC:4.1.2.13]",18,4,1,12,11,5,18,9,2,7
K13628: iscA; iron-sulfur cluster assembly protein,34,6,1,8,14,4,10,3,2,5
K00024: mdh; malate dehydrogenase [EC:1.1.1.37],6,1,3,13,15,8,14,11,7,7
"K00031: IDH1, IDH2, icd; isocitrate dehydrogenase [EC:1.1.1.42]",14,3,5,10,11,19,14,2,2,5
"K01649: leuA, IMS; 2-isopropylmalate synthase [EC:2.3.3.13]",12,2,7,8,8,5,14,21,2,6
"K01868: TARS, thrS; threonyl-tRNA synthetase [EC:6.1.1.3]",8,2,9,10,6,20,0,18,7,5
"K01870: IARS, ileS; isoleucyl-tRNA synthetase [EC:6.1.1.5]",6,3,9,11,6,14,12,14,5,5
K02704: psbB; photosystem II CP47 chlorophyll apoprotein,14,6,0,11,10,11,14,6,8,5
K07497: K07497; putative transposase,14,0,17,6,6,14,8,9,7,4
K14194: sdrC_D_E; serine-aspartate repeat-containing protein C/D/E,14,3,0,4,7,3,10,29,5,10
"K01551: arsA, ASNA1, GET3; arsenite/tail-anchored protein-transporting ATPase [EC:7.3.2.7 7.3.-.-]",2,2,1,1,4,11,24,12,12,15
K02286: cpcC; phycocyanin-associated rod linker protein,22,6,0,14,8,10,4,11,8,1
K02666: pilQ; type IV pilus assembly protein PilQ,16,1,16,9,4,7,10,5,8,8
K05587: hoxF; bidirectional [NiFe] hydrogenase diaphorase subunit [EC:7.1.1.2],2,0,1,11,10,11,14,10,16,9
K11180: dsrA; dissimilatory sulfite reductase alpha subunit [EC:1.8.99.5],0,0,0,6,1,13,24,8,18,14
"K00175: korB, oorB, oforB; 2-oxoglutarate/2-oxoacid ferredoxin oxidoreductase subunit beta [EC:1.2.7.3 1.2.7.11]",10,0,1,4,10,12,10,22,6,8
K02001: proW; glycine betaine/proline transport system permease protein,6,0,2,7,2,18,10,22,6,10
"K02529: lacI, galR; LacI family transcriptional regulator",2,0,6,10,9,10,20,14,1,11
K06596: chpA; chemosensory pili system protein ChpA (sensor histidine kinase/response regulator),20,0,5,3,5,7,6,7,20,10
K00975: glgC; glucose-1-phosphate adenylyltransferase [EC:2.7.7.27],20,2,0,7,10,12,10,14,4,3
K03111: ssb; single-strand DNA-binding protein,8,2,0,8,2,18,14,11,12,7
K07736: carD; CarD family transcriptional regulator,12,1,1,7,3,18,22,14,1,3
"K15770: cycB, ganO; arabinogalactan oligomer / maltooligosaccharide transport system substrate-binding protein",10,0,0,9,3,22,8,9,11,10
"K02482: K02482; two-component system, NtrC family, sensor kinase [EC:2.7.13.3]",2,1,1,3,7,18,12,22,6,9
"K02992: RP-S7, MRPS7, rpsG; small subunit ribosomal protein S7",16,1,1,9,9,5,10,17,9,4
K05366: mrcA; penicillin-binding protein 1A [EC:2.4.1.129 3.4.16.4],28,1,10,10,8,6,2,11,1,4
K05808: yhbH; putative sigma-54 modulation protein,10,3,2,9,13,20,2,8,8,6
"K05875: tar; methyl-accepting chemotaxis protein II, aspartate sensor receptor",2,0,12,1,2,22,8,17,13,4
K07304: msrA; peptide-methionine (S)-S-oxide reductase [EC:1.8.4.11],28,4,3,3,9,15,8,6,4,1
